{
  "$schema": "./config.schema.json",
  "deployProfile": "runtime",
  "tenantId": "22222222-2222-2222-2222-222222222222",
  "subscriptionId": "11111111-1111-1111-1111-111111111111",
  "environment": "dev",
  "location": "koreacentral",
  "projectName": "a365gw",
  "resourceGroupName": "rg-a365gw-runtime-dev",
  "runtime": {
    "apiHostPort": 5080,
    "consoleHostPort": 5081
  },
  "agent365": {
    "seedBlueprintName": "A365 Gateway Seed runtime-dev",
    "allowDevelopmentRegistryPreview": false,
    "registryBetaAcknowledged": false,
    "reviewedManagerApplicationIds": [
      "33333333-3333-4333-8333-333333333333"
    ]
  },
  "promptShield": {
    "enabled": true,
    "skuName": "F0",
    "costAndQuotaAcknowledged": true
  },
  "purview": {
    "enabled": false,
    "authorityRequirementsAcknowledged": false
  }
}
